{
  "$schema": "https://raw.githubusercontent.com/oliverbravery/PrintGuard/main/plugins/plugin.schema.json",
  "id": "progress-reports",
  "name": "Progress reports",
  "version": "1.0.1",
  "description": "Sends how far a print has got and how many defects it has seen, as often as you ask.",
  "author": "oliverbravery",
  "homepage": "https://github.com/oliverbravery/PrintGuard/tree/main/plugins/progress-reports",
  "icon": "icon.png",
  "media": [
    "shots/settings.png"
  ],
  "permissions": [
    "state:read",
    "alert:send"
  ],
  "reasons": {
    "state:read": "To read how far a print has got and how many defects it has seen.",
    "alert:send": "To send the tally through your alert channels."
  },
  "surfaces": [
    "settings"
  ],
  "events": [
    "result",
    "alert"
  ],
  "tick_s": 60
}
